{
  "counts": {
    "output_bytes": 189773,
    "sounds": 27
  },
  "inputs": {
    "expected_sync_offset": 9,
    "inspection": "tools/asset-registry/inspection.json",
    "inspection_fingerprint": "de4f522343189cc621f732701d6912ebfb6f8be028191f03b7dfb709cb2688fa"
  },
  "policy": "sound-extraction-v1",
  "result": "success",
  "schema_version": 1,
  "sounds": [
    {
      "character_id": 1,
      "format": 2,
      "output": "assets/converted/sounds/1.mp3",
      "output_bytes": 1248,
      "payload_bytes": 1257,
      "rate": 1,
      "sha256": "6ff560313fb123bd26fb792046b5ed186678fc0148948a6eef02d679cd2ade30",
      "size": 1,
      "sound_type": 0,
      "sync_offset": 9
    },
    {
      "character_id": 2,
      "format": 2,
      "output": "assets/converted/sounds/2.mp3",
      "output_bytes": 1456,
      "payload_bytes": 1465,
      "rate": 1,
      "sha256": "6275307cefe5b13c1da90246ee90bf6fb346533f1529eb0bbec18a410b2ebff4",
      "size": 1,
      "sound_type": 0,
      "sync_offset": 9
    },
    {
      "character_id": 3,
      "format": 2,
      "output": "assets/converted/sounds/3.mp3",
      "output_bytes": 5616,
      "payload_bytes": 5625,
      "rate": 1,
      "sha256": "c3dd5f5e7850a7033934b08146ee5daa51f5b232f6026add41f8438016e5b1aa",
      "size": 1,
      "sound_type": 0,
      "sync_offset": 9
    },
    {
      "character_id": 4,
      "format": 2,
      "output": "assets/converted/sounds/4.mp3",
      "output_bytes": 12376,
      "payload_bytes": 12385,
      "rate": 1,
      "sha256": "fa83610a08293a89e5e52df153452dd5ea9e9a4a2d4b00597d46ccde503dc9a4",
      "size": 1,
      "sound_type": 0,
      "sync_offset": 9
    },
    {
      "character_id": 5,
      "format": 2,
      "output": "assets/converted/sounds/5.mp3",
      "output_bytes": 1248,
      "payload_bytes": 1257,
      "rate": 1,
      "sha256": "afa2e0e25ea89dac32f25c7ce6fa770055d2e597fac826c0d76ca2b9e32961b9",
      "size": 1,
      "sound_type": 0,
      "sync_offset": 9
    },
    {
      "character_id": 6,
      "format": 2,
      "output": "assets/converted/sounds/6.mp3",
      "output_bytes": 20696,
      "payload_bytes": 20705,
      "rate": 2,
      "sha256": "ef8d104fc263a47153de89e88046ce8f63d8f4645babc1abd61d76b237d100db",
      "size": 1,
      "sound_type": 0,
      "sync_offset": 9
    },
    {
      "character_id": 7,
      "format": 2,
      "output": "assets/converted/sounds/7.mp3",
      "output_bytes": 8864,
      "payload_bytes": 8873,
      "rate": 3,
      "sha256": "e4e74a8ce64ef5e5d4b644ae64b4daf55e72055d554ba33a510a790ec6f856ac",
      "size": 1,
      "sound_type": 0,
      "sync_offset": 9
    },
    {
      "character_id": 8,
      "format": 2,
      "output": "assets/converted/sounds/8.mp3",
      "output_bytes": 6448,
      "payload_bytes": 6457,
      "rate": 1,
      "sha256": "8756a8a3011adb4a4e134c5e7d823d97a714142ba0810ad7c43b3a6a97057a89",
      "size": 1,
      "sound_type": 0,
      "sync_offset": 9
    },
    {
      "character_id": 9,
      "format": 2,
      "output": "assets/converted/sounds/9.mp3",
      "output_bytes": 9776,
      "payload_bytes": 9785,
      "rate": 2,
      "sha256": "b5ef76a0f60927d70f2a87aac322e983f47805e12e1be0264e9e206e9cf0d7af",
      "size": 1,
      "sound_type": 0,
      "sync_offset": 9
    },
    {
      "character_id": 10,
      "format": 2,
      "output": "assets/converted/sounds/10.mp3",
      "output_bytes": 5928,
      "payload_bytes": 5937,
      "rate": 1,
      "sha256": "b51704788c839c2aa104b92a8a34a6efd711a10a5758a658655165a404a209be",
      "size": 1,
      "sound_type": 0,
      "sync_offset": 9
    },
    {
      "character_id": 11,
      "format": 2,
      "output": "assets/converted/sounds/11.mp3",
      "output_bytes": 7859,
      "payload_bytes": 7868,
      "rate": 3,
      "sha256": "6f4966191eca6a025f3833e295075606197ebd35cbf7a44798d91fe3222c1d9e",
      "size": 1,
      "sound_type": 0,
      "sync_offset": 9
    },
    {
      "character_id": 12,
      "format": 2,
      "output": "assets/converted/sounds/12.mp3",
      "output_bytes": 5978,
      "payload_bytes": 5987,
      "rate": 3,
      "sha256": "a41266c1937dbba196772bb22f5933b27abdf3e79347113c832b33889104fa20",
      "size": 1,
      "sound_type": 0,
      "sync_offset": 9
    },
    {
      "character_id": 13,
      "format": 2,
      "output": "assets/converted/sounds/13.mp3",
      "output_bytes": 5769,
      "payload_bytes": 5778,
      "rate": 3,
      "sha256": "3ace7a492838e5d3f6ce8d5c03e5ee0e9b4dcbe3b5922d42c1cd7178d6647768",
      "size": 1,
      "sound_type": 0,
      "sync_offset": 9
    },
    {
      "character_id": 14,
      "format": 2,
      "output": "assets/converted/sounds/14.mp3",
      "output_bytes": 3679,
      "payload_bytes": 3688,
      "rate": 3,
      "sha256": "ad70ca44f9c2a275779e9caa86de313c7cab3314309489508e28eaf92fe26442",
      "size": 1,
      "sound_type": 0,
      "sync_offset": 9
    },
    {
      "character_id": 15,
      "format": 2,
      "output": "assets/converted/sounds/15.mp3",
      "output_bytes": 4472,
      "payload_bytes": 4481,
      "rate": 1,
      "sha256": "aef7722af80e9ccef7fd2820a1c103947bf6ccbd9b6919704e6feed27c284745",
      "size": 1,
      "sound_type": 0,
      "sync_offset": 9
    },
    {
      "character_id": 16,
      "format": 2,
      "output": "assets/converted/sounds/16.mp3",
      "output_bytes": 9490,
      "payload_bytes": 9499,
      "rate": 2,
      "sha256": "ff705ab7c1b3a67e02b948f87592f92fef14e9151cd0a4699bdbb45bde14a250",
      "size": 1,
      "sound_type": 0,
      "sync_offset": 9
    },
    {
      "character_id": 17,
      "format": 2,
      "output": "assets/converted/sounds/17.mp3",
      "output_bytes": 832,
      "payload_bytes": 841,
      "rate": 1,
      "sha256": "a22602274578c5dbf271d67274917370fc5e98afb952cc25c11af5c5e5f52e2b",
      "size": 1,
      "sound_type": 0,
      "sync_offset": 9
    },
    {
      "character_id": 18,
      "format": 2,
      "output": "assets/converted/sounds/18.mp3",
      "output_bytes": 2392,
      "payload_bytes": 2401,
      "rate": 1,
      "sha256": "2de1071374f8be0d7f6b32017d3c4f5be7ff35e80ffc2d7a8ef8b1c68862a117",
      "size": 1,
      "sound_type": 0,
      "sync_offset": 9
    },
    {
      "character_id": 19,
      "format": 2,
      "output": "assets/converted/sounds/19.mp3",
      "output_bytes": 6448,
      "payload_bytes": 6457,
      "rate": 1,
      "sha256": "5c322a12e11a28ab166b0e678e64c06050d7f4cf164ca3dc0879d500349e8548",
      "size": 1,
      "sound_type": 0,
      "sync_offset": 9
    },
    {
      "character_id": 20,
      "format": 2,
      "output": "assets/converted/sounds/20.mp3",
      "output_bytes": 5561,
      "payload_bytes": 5570,
      "rate": 3,
      "sha256": "41205f8d0b3bb827caca454eae467a0e6f56742729d1163ad537cc701cbcfb3f",
      "size": 1,
      "sound_type": 1,
      "sync_offset": 9
    },
    {
      "character_id": 21,
      "format": 2,
      "output": "assets/converted/sounds/21.mp3",
      "output_bytes": 16114,
      "payload_bytes": 16123,
      "rate": 3,
      "sha256": "222d16e149cc84308e682b105b299bea56f2787e8bcb8bec74036ed868a092cf",
      "size": 1,
      "sound_type": 0,
      "sync_offset": 9
    },
    {
      "character_id": 22,
      "format": 2,
      "output": "assets/converted/sounds/22.mp3",
      "output_bytes": 13936,
      "payload_bytes": 13945,
      "rate": 2,
      "sha256": "ea2bb6ff3a4f898043abec3bc75fa98f57f20f213cb6382720a6a5a0eddacbcb",
      "size": 1,
      "sound_type": 0,
      "sync_offset": 9
    },
    {
      "character_id": 23,
      "format": 2,
      "output": "assets/converted/sounds/23.mp3",
      "output_bytes": 8864,
      "payload_bytes": 8873,
      "rate": 3,
      "sha256": "d0a34296dafd9ff457252cf361ff0ec498e431af2222c0fa261c95547b0206cc",
      "size": 1,
      "sound_type": 0,
      "sync_offset": 9
    },
    {
      "character_id": 24,
      "format": 2,
      "output": "assets/converted/sounds/24.mp3",
      "output_bytes": 6187,
      "payload_bytes": 6196,
      "rate": 3,
      "sha256": "56de55d0bfcaa5c87cdda8952c9afc1fc64894c838bdcc9adb5dbb47eb1779e7",
      "size": 1,
      "sound_type": 0,
      "sync_offset": 9
    },
    {
      "character_id": 25,
      "format": 2,
      "output": "assets/converted/sounds/25.mp3",
      "output_bytes": 5952,
      "payload_bytes": 5961,
      "rate": 3,
      "sha256": "254c07e91ab63220c0f39b6aceb3d35c3a5bd79ad11008c83ab2cc7e71c44abc",
      "size": 1,
      "sound_type": 0,
      "sync_offset": 9
    },
    {
      "character_id": 26,
      "format": 2,
      "output": "assets/converted/sounds/26.mp3",
      "output_bytes": 3848,
      "payload_bytes": 3857,
      "rate": 1,
      "sha256": "9a3960e5ae33091f63fd3824aa86f89f39fd2e0621e69d6cd24a569c648df965",
      "size": 1,
      "sound_type": 0,
      "sync_offset": 9
    },
    {
      "character_id": 27,
      "format": 2,
      "output": "assets/converted/sounds/27.mp3",
      "output_bytes": 8736,
      "payload_bytes": 8745,
      "rate": 2,
      "sha256": "1b752f7fdab99db8268d5069595b4e51f0e04d1429577f113fa6a5d2f2d08eb0",
      "size": 1,
      "sound_type": 0,
      "sync_offset": 9
    }
  ]
}
